query,score
Logic of deleting in Java,48
How can I add child fragments to a fragment in Android using a BaseAdapter,16
Array variable initialization error in Java,14
Can I get the instance in a method using Guice?,13
i am having an error on my txtfile reader prgram,7
Find majority number in an array,6
How to return an html document from java servlet?,6
How to connect to web-socket server from android app,5
JavaFX Spinner Editor in TableView,5
Data from textView deleting after i rotate screen after i implemented onSaveInstance and onRestoreInstance,4
Mapping database lookups to jpa entities,4
How to create a unique list from a list containing duplicate items java,4
Graph plotting in Java Swing only draws points,3
Does BeanUtils.copyProperties make a deep clone?,3
How to change JLabel's size when the font size is changed?,3
Not getting value from query string,3
ZXING Android Embedded Usage of IntentIntegrator,3
Specify field is transient for MongoDB but not for RestController,3
Signaling a thread to terminate whenever it reached a stable situation,2
How to save a HashMap (as object property) to the Datastore,2
How to fetch and show data (on new activity) from SQLite in android,2
"DAO methods parameters , object-references vs ids",2
@OneToOne from two classes to same class,2
GSON-JSON Deserialize Object in Class,2
Apache Camel and CXF : How do i send HTTP status code from bean,2
Accessing subclass variables via interface,2
How using a local object reference is thread safe?,2
Selecting a period or a date using ONE JavaFX 8 DatePicker,1
Advice on Android Thread,1
Simulating C++-typedefs in Java,1
Using a JavaFx application instance from another class,1
Generic Class Arguments in Java,1
How to return a Bitmap from an Async Task in Android app,1
Calling a synchronized from inside a non-synchronized method,1
Use Prepared Statement with Dropwizard JDBI and PostgreSQL UUID column,1
Spliting String with delimiter and holding the values,1
How to get input from user for Hashmap using Scanner,1
"How to use a variable of one class, in another in Java?",1
Java concentrate is there a way to shuffle jbuttons,1
JColorChooser and JFileChooser open problem,1
The Fibonacci runner code: JAVA,1
calling method with IOException,1
How to specify notification between threads if they don't have common data in Java,1
Spring batch : JobExecution from PreparedStatementSetter,1
Need to figure out what to do with sparsematrix,1
slow listview when set custom font,1
Java JDialogs How To Pass Information Between?,1
Java Embedded Comparator Class,1
Unable to print out ArrayList (Possible Logic Error in Code),1
I am trying to call a method in a class that is within a class,1
Color histogram of the picture in java - wrong results,1
Getting input from example : java calculate 10x20,0
"JSONObject always returns ""empty"": false",0
Soap web service not getting published for Custom Object return type in Java,0
Restricting a field to be an instance of a class AND implementing an interface at the same time,0
How to implement abstract class via reflection,0
Java tricky inheritance and call classes and methods,0
Get JButton from another JButton,0
onOptionsItemSelected() method not get called on Fragment,0
Spring REST custom error-object handling in client,0
How do I call a generic static method thats in the main class from the main method?,0
Selenium with TestNG Script is not working?,0
Exporting grid in excel in Vaadin 14,0
How to apply user defined try catch block in java,0
Jackson Json parse error,0
Transform instance method to abstract method when overriding,0
How to call a method from another class using Java,0
Error code compiling: illegal start of expression,0
Payara 5 @JMSConnectionFactory fails to inject when using @Stateless bean,0
How to @Autowire a SessionFactory to a Servlet?,0
Most effective implementation of repeating browser automation in the same session,0
Java custom warnings,0
Guice injection doesn't work in ServletContextListener,0
java.lang.UnsatisfiedLinkError: Native Library XXX.so already loaded in another classloader,0
Selenium Webdriver Function Continuity,0
To print only 3 consecutive character from given string,0
Android Studio Attempt to invoke virtual method on a null object reference error,0
Make a component span multiple rows in GridBagLayout when using only one column,0
vertx.io java + twitter4j - event loop integration,0
I have to create a Binary Expression tree that stores the expression 2 + 4 - 3 in java,0
Can I make a static factory method in an abstract class?,0
How to make my JButton connect with my JFrame?,0
how does this code give new id for each thing object. id should be equal to 1 all the time,0
Randomly change color of a rectangle with mouse click,-1
Binding a child object of an XmlElement list to a Java object using Jackson XmlMapper,-1
Custom View children are null after inflating the view in Android,-1
NullPointerException in JFrame,-1